ID,Name,Concepticon_ID,Concepticon_Gloss,Chinese_Gloss
oldlaobunen,old (lǎo (bù nèn) 老(不嫩)),2112,OLD (AGED),老(不嫩)
inexperiencednen,inexperienced (nèn 嫩),,,嫩
fragilecui,fragile (cuì 脆),,,脆
robustjieshi,robust (jié shí 結實),,,結實
unripeshengbushu,unripe (shēng (bù shú) 生(不熟)),1958,UNRIPE,生(不熟)
tidyneatzhengqi,"tidy, neat (zhěng qí 整齊)",,,整齊
brokenpo,broken (pò 破),588,BROKEN,破
swallowyanzi,swallow (yàn zi 燕子),897,SWALLOW,燕子
cleanganjing,clean (gàn jìng 幹淨),704,CLEAN,幹淨
dirtyangzang,dirty (āng zāng 骯髒),1230,DIRTY,骯髒
blurredintransparentmohu,"blurred, intransparent (mó hú 模糊)",,,模糊
muddyhun,muddy (hún 渾),537,TURBID,渾
sharpknifekuaifengli,sharp (knife) (kuài (fēng lì) 快(鋒利)),1396,SHARP,快(鋒利)
quickfastkuaixunsu,"quick, fast (kuài (xùn sù) 快(迅速))",1631,FAST,快(迅速)
latewan,late (wǎn 晚),477,LATE,晚
goodhao,good (hǎo 好),1035,GOOD,好
badhuai,bad (huài 壞),1292,BAD,壞
difficultnan,difficult (nán 難),584,DIFFICULT,難
easyrongyi,easy (róng yì 容易),686,EASY,容易
expensivegui,expensive (guì 貴),1426,EXPENSIVE,貴
hotfoodsharpfoodtang,"hot (food), sharp (food) (tàng 燙)",544,SPICY,燙
magpiexique,magpie (xǐ què 喜鵲),2039,MAGPIE,喜鵲
warmnuanhuo,warm (nuǎn huo 暖和),1232,WARM,暖和
lukewarmwen,lukewarm (wēn 溫),,,溫
coldcoolliang,"cold, cool (liáng 涼)",2483,COLD (OF WEATHER),涼
stinkingchou,stinking (chòu 臭),42,STINKING,臭
saltyxian,salty (xián 鹹),1091,SALTY,鹹
tastelessdan,tasteless (dàn 淡),1771,TASTELESS,淡
hungrye,hungry (è 餓),1533,BE HUNGRY,餓
thirstyke,thirsty (kě 渴),847,THIRSTY,渴
sparrowmaque,sparrow (má què 麻雀),1854,SPARROW,麻雀
tiredlei,tired (lèi 累),1757,TIRED,累
itchyyang,itchy (yǎng 癢),149,ITCHY,癢
busymang,busy (máng 忙),2755,BUSY,忙
idlexian,idle (xián 閑),2756,IDLE,閑
fatobesepang,"fat, obese (pàng 胖)",1279,FAT (OBESE),胖
fatoilyfei,"fat, oily (féi 肥)",2719,FAT (OILY),肥
thinshou,thin (shòu 瘦),1400,THIN (SLIM),瘦
oldagedlaobunianqing,"old, aged (lǎo (bù nián qīng) 老(不年輕))",2112,OLD (AGED),老(不年輕)
youngnianqing,young (nián qīng 年輕),1207,YOUNG,年輕
pigeondovegezi,"pigeon, dove (gē zi 鴿子)",1853,DOVE,鴿子
goodlookingbeautifulhaokanpiaoliang,"goodlooking, beautiful (hǎo kàn 、 piào liàng 好看、漂亮)",2410,GOOD-LOOKING,好看、漂亮
uglynankanchou,ugly (nán kàn 、 chǒu 難看、醜),1548,UGLY,難看、醜
strongqiangzhuang,strong (qiáng zhuàng 強壯),785,STRONG,強壯
stupidsha,stupid (shǎ 傻),1518,STUPID,傻
honestlaoshi,honest (lǎo shí 老實),1120,HONEST,老實
honestfrankzhishuang,"honest, frank (zhí shuǎng 直爽)",1120,HONEST,直爽
cheapstingyxiaoqi,"cheap, stingy (xiǎo qì 小氣)",1774,STINGY,小氣
proudjiaoao,proud (jiāo ào 驕傲),174,PROUD,驕傲
crestedmynabage,crested myna (bā gē 八哥),2346,CRESTED MYNA,八哥
modestqianxu,modest (qiān xū 謙虛),,,謙虛
wellbehavedguai,well-behaved (guāi 乖),,,乖
lazylan,lazy (lǎn 懶),1564,LAZY,懶
capablenenggan,capable (néng gàn 能幹),,,能幹
competentneixing,competent (nèi xíng 內行),,,內行
cattleshengkou,cattle (shēng kǒu 牲口),1153,CATTLE,牲口
havingbadluckdaomei,having bad luck (dào méi 倒黴),,,倒黴
strangeqiguai,strange (qí guài 奇怪),600,STRANGE,奇怪
scaryhaipa,scary (hài pà 害怕),,,害怕
maremuma,mare (mǔ mǎ 母馬),938,MARE,母馬
ifirstpersonsingularwo,I (first person singular) (wǒ 我),1209,I,我
yousecondpersonsingularni,you (second person singular) (nǐ 你),1215,THOU,你
hesheitthirdpersonsingularta,"he, she, it (third person singular) (tā 他)",262,HE OR SHE OR IT,他
wefirstpersonpluralwomen,we (first person plural) (wǒ men 我們),1212,WE,我們
bullgongniu,bull (gōng niú 公牛),1008,BULL,公牛
wefirstpersonpluralinclusivezanmen,we (first person plural inclusive) (zán men 咱們),1131,WE (INCLUSIVE),咱們
yousecondpersonpluralnimen,you (second person plural) (nǐ men 你們),1213,YOU,你們
theythirdpersonpluraltamen,they (third person plural) (tā men 他們),817,THEY,他們
alleverybodydajia,"all, everybody (dà jiā 大家)",98,ALL,大家
selfoneselfziji,"self, oneself (zì jǐ 自己)",1993,SELF,自己
howmuchtowhichdegreeduome,"how much, to which degree (duō me 多麽)",531,HOW MUCH,多麽
theytheothersthirdpersonpluralrenjia,"they, the others (third person plural) (rén jiā 人家)",817,THEY,人家
myfirstpersonsingularwode,my (first person singular) (wǒ de 我的),2090,MY,我的
yoursecondpersonsingularnide,your (second person singular) (nǐ de 你的),732,YOUR (SINGULAR),你的
hisheritsthirdpersonsingulartade,"his, her, its (third person singular) (tā de 他的)",2092,HIS OR HER,他的
othersoftheothersbiede,"others, of the others (bié de 別的)",,,別的
thesezhexie,these (zhè xiē 這些),1214,THIS,這些
thosenaxie,those (nà xiē 那些),78,THAT,那些
herezheer,here (zhè ér 這兒),136,HERE,這兒
howlongduojiu,how long (duō jiǔ 多久),2338,HOW LONG,多久
thatsidetherenabian,"that side, there (nà biān 那邊)",1937,THERE,那邊
thiswayzheme,this way (zhè me 這麽),,,這麽
thatwayname,that way (nà me 那麽),,,那麽
stalliongongma,stallion (gōng mǎ 公馬),936,STALLION,公馬
whoshui,who (shuí 誰),1235,WHO,誰
whatshenme,what (shén me 什麽),1236,WHAT,什麽
whichnage,which (nǎ gè 哪個),727,WHICH,哪個
wherenaer,where (nǎ ér 哪兒),1237,WHERE,哪兒
whichplacewherenabian,"which place, where (nǎ biān 哪邊)",1237,WHERE,哪邊
howzenme,how (zěn me 怎麽),1239,HOW,怎麽
howmuchduoshao,how much (duō shǎo 多少),531,HOW MUCH,多少
piececlassifierforpersonsyigeren,piece (classifier for persons) (yī gè rén 一個人),516,PERSON (CLASSIFIER),一個人
